{
  "$schema": "https://roblox-top1.local/schemas/transfer-review.schema.json",
  "schemaVersion": "1.0.0",
  "assetId": "turret_fast_v1",
  "status": "PENDING",
  "selectedTerritory": "salvaged-frontier",
  "reviewer": null,
  "reviewedAt": null,
  "evidencePackageSha256": null,
  "decision": null,
  "scores": null,
  "scoreTotal": null,
  "rationale": null
}
